{
  "proxy": "course.prafdin.ru",
  "sa_login": "SA3000UDP",
  "sa_mail": "pravdin.web@gmail.com",
  "timeout": 180,
  "poll_interval": 15,
  "users": [
    {
      "login": "SA3000UDP",
      "id": "sa3000udp",
      "app": "catty-reminders-app"
    },
    {
      "login": "Velesikamid",
      "id": "kiselev",
      "app": "catty-reminders-app"
    },
    {
      "login": "sh1kaff",
      "id": "sheff",
      "app": "catty-reminders-app"
    }
  ]
}
